CNN/resultados_experimentos/tabla_resumen.csv

resolution,quant,accuracy,inference_single_ms,n_test,model_size_kb
256x256,float32,0.8318518518518518,7.567877108148154,1350,
256x256,int8,0.825925925925926,207.1756975688888,1350,120.7734375
256x256,int16,0.8274074074074074,264.21212444518494,1350,141.8671875
128x128,float32,0.6762962962962963,3.3505267140740385,1350,
128x128,int8,0.68,214.83168886518527,1350,120.7734375
128x128,int16,0.6762962962962963,218.28725408592584,1350,141.8671875
96x96,float32,0.725925925925926,3.729575029629578,1350,
96x96,int8,0.7229629629629629,201.9591300718518,1350,120.65625
96x96,int16,0.7266666666666667,213.96106786074057,1350,141.75

CNN/analisis.md

#### RESOLUCION 256

* Indexado de archivos:  $0.434$ s.
* Total de $9000$ imagenes | $9$ clases.
* [ Train $=$ $6300$,  Val $=$ $1350$,  Test $=$ $1350$ ].
* Entrenamiento: $8254.509$ s.
![ Accuracy vs Loss in Training ]( resultados_experimentos/training_256x256.png )
* Accuracy: $0.8319$.
* Confussion Matrix:
![ Confussion Matrix $256$ $\times$ $256$ (float32) ]( resultados_experimentos/cm_256x256_float32.png )

* Conversion de parametros a INT8: $48.953$ s.
* Tamaño del modelo en INT8: $120.8$ KB.
* Accuracy int8: $0.8259$.
* Confussion Matrix:
![ Confussion Matrix $256$ $\times$ $256$ (int8) ]( resultados_experimentos/cm_256x256_int8.png )

* Conversion de parametros a INT16: $95.270$ s.
* Tamaño del modelo en INT8: $141.9$ KB.
* Accuracy int16: $0.8274$.
* Confussion Matrix:
![ Confussion Matrix $256$ $\times$ $256$ (int16) ]( resultados_experimentos/cm_256x256_int16.png )

#### RESOLUCION 128

* Entrenamiento: $8052.963$ s.
![ Accuracy vs Loss in Training ]( resultados_experimentos/training_128x128.png)
* Accuracy: $0.6763$.
* Tiempo de evaluacion: $75.031$ s.
* Confussion Matrix:
![ Confussion Matrix $128$ $\times$ $128$ (float32) ]( resultados_experimentos/cm_128x128_float32.png )

* Conversion de parametros a INT8: $42.980$ s.
* Tamaño del modelo en INT8: $120.8$ KB.
* Accuracy int8: $0.6800$.
* Confussion Matrix:
![ Confussion Matrix $128$ $\times$ $128$ (int8) ]( resultados_experimentos/cm_128x128_int8.png )

* Conversion de parametros a INT16: $82.207$ s.
* Tamaño del modelo en INT8: $141.9$ KB.
* Accuracy int16: $0.6763$.
* Confussion Matrix:
![ Confussion Matrix $128$ $\times$ $128$ (int16 ]( resultados_experimentos/cm_128x128_int16.png )

#### RESOLUCION 96

* Entrenamiento: $8052.963$ s.
![ Accuracy vs Loss in Training ]( resultados_experimentos/training_96x96.png    )
* Accuracy: $0.7259$.
* Tiempo de evaluacion: $72.404$ s.
* Confussion Matrix:
![ Confussion Matrix $96$ $\times$ $96$ (float32) ]( resultados_experimentos/cm_96x96_float32.png )

* Conversion de parametros a INT8: $41.845$ s.
* Tamaño del modelo en INT8: $120.7$ KB.
* Accuracy int8: $0.7230$.
* Confussion Matrix:
![ Confussion Matrix $96$ $\times$ $96$ (int8) ]( resultados_experimentos/cm_96x96_int8.png )

* Conversion de parametros a INT16: $81.680$ s.
* Tamaño del modelo en INT8: $141.8$ KB.
* Accuracy int16: $0.7267$.
* Confussion Matrix:
![ Confussion Matrix $96$ $\times$ $96$ (int16) ]( resultados_experimentos/cm_96x96_int16.png )

#### RESOLUCION 256

* Conversion de parametros a INT8: $35.354$ s.
* Tamaño del modelo en INT8: $120.8$ KB.
* Accuracy int8: $0.8837$.
* Confussion Matrix:
![ Confussion Matrix $256$ $\times$ $256$ (int8) ]( resultados_experimentos_2/cm_256x256_int8.png )

* Conversion de parametros a INT16: $67.825$ s.
* Tamaño del modelo en INT8: $141.9$ KB.
* Accuracy int16: $0.8867$.
* Confussion Matrix:
![ Confussion Matrix $256$ $\times$ $256$ (int16) ]( resultados_experimentos_2/cm_256x256_int16.png )

#### RESOLUCION 128

* Conversion de parametros a INT8: $31.813$ s.
* Tamaño del modelo en INT8: $120.8$ KB.
* Accuracy int8: $0.7104$.
* Confussion Matrix:
![ Confussion Matrix $128$ $\times$ $128$ (int8) ]( resultados_experimentos_2/cm_128x128_int8.png )

* Conversion de parametros a INT16: $58.952$ s.
* Tamaño del modelo en INT8: $141.9$ KB.
* Accuracy int16: $0.7015$.
* Confussion Matrix:
![ Confussion Matrix $128$ $\times$ $128$ (int16 ]( resultados_experimentos_2/cm_128x128_int16.png )

#### RESOLUCION 96

* Conversion de parametros a INT8: $30.056$ s.
* Tamaño del modelo en INT8: $120.7$ KB.
* Accuracy int8: $0.7689$.
* Confussion Matrix:
![ Confussion Matrix $96$ $\times$ $96$ (int8) ]( resultados_experimentos_2/cm_96x96_int8.png )

* Conversion de parametros a INT16: $59.788$ s.
* Tamaño del modelo en INT8: $141.8$ KB.
* Accuracy int16: $0.7667$.
* Confussion Matrix:
![ Confussion Matrix $96$ $\times$ $96$ (int16) ]( resultados_experimentos_2/cm_96x96_int16.png )